{
  "environments": [],
  "generated_at": "sha256:df6655603ea7c04cd837cdb927689857812ad620394d0595949442930237e108",
  "generator_status": "generated",
  "generator_version": 3,
  "kinds": [
    {
      "id": "actuator.force",
      "exists": true,
      "solver": "mechanics",
      "simulated": true,
      "confidence": "partial",
      "exercised_by_cases": [
        "mechanics/coupling"
      ]
    },
    {
      "id": "actuator.servo",
      "exists": true,
      "solver": "mechanics",
      "simulated": true,
      "confidence": "partial",
      "exercised_by_cases": []
    },
    {
      "id": "actuator.thruster",
      "exists": true,
      "solver": "mechanics",
      "simulated": true,
      "confidence": "partial",
      "exercised_by_cases": [
        "mechanics/boat-speed",
        "mechanics/boat-speed",
        "mechanics/determinism"
      ]
    },
    {
      "id": "board.arduino-mega",
      "exists": true,
      "solver": "mcu",
      "simulated": true,
      "confidence": "partial",
      "exercised_by_cases": []
    },
    {
      "id": "board.arduino-nano",
      "exists": true,
      "solver": "mcu",
      "simulated": true,
      "confidence": "partial",
      "exercised_by_cases": []
    },
    {
      "id": "board.arduino-uno",
      "exists": true,
      "solver": "mcu",
      "simulated": true,
      "confidence": "partial",
      "exercised_by_cases": []
    },
    {
      "id": "board.esp32-c3",
      "exists": true,
      "solver": null,
      "simulated": false,
      "confidence": "experimental",
      "exercised_by_cases": []
    },
    {
      "id": "board.esp32-devkit-c-v4",
      "exists": true,
      "solver": null,
      "simulated": false,
      "confidence": "experimental",
      "exercised_by_cases": []
    },
    {
      "id": "board.esp32-devkit-v1",
      "exists": true,
      "solver": null,
      "simulated": false,
      "confidence": "experimental",
      "exercised_by_cases": []
    },
    {
      "id": "board.esp32-s3",
      "exists": true,
      "solver": null,
      "simulated": false,
      "confidence": "experimental",
      "exercised_by_cases": []
    },
    {
      "id": "board.franzininho",
      "exists": true,
      "solver": null,
      "simulated": false,
      "confidence": "experimental",
      "exercised_by_cases": []
    },
    {
      "id": "board.nano-rp2040-connect",
      "exists": true,
      "solver": null,
      "simulated": false,
      "confidence": "experimental",
      "exercised_by_cases": []
    },
    {
      "id": "board.pi-pico",
      "exists": true,
      "solver": "mcu",
      "simulated": true,
      "confidence": "partial",
      "exercised_by_cases": []
    },
    {
      "id": "board.pi-pico-w",
      "exists": true,
      "solver": "mcu",
      "simulated": true,
      "confidence": "partial",
      "exercised_by_cases": []
    },
    {
      "id": "board.raspberry-pi-3",
      "exists": true,
      "solver": null,
      "simulated": false,
      "confidence": "experimental",
      "exercised_by_cases": []
    },
    {
      "id": "board.raspberry-pi-4",
      "exists": true,
      "solver": null,
      "simulated": false,
      "confidence": "experimental",
      "exercised_by_cases": []
    },
    {
      "id": "board.raspberry-pi-5",
      "exists": true,
      "solver": null,
      "simulated": false,
      "confidence": "experimental",
      "exercised_by_cases": []
    },
    {
      "id": "electromech.biaxial-stepper",
      "exists": true,
      "solver": null,
      "simulated": false,
      "confidence": "experimental",
      "exercised_by_cases": []
    },
    {
      "id": "electromech.ks2e-m-dc5",
      "exists": true,
      "solver": null,
      "simulated": false,
      "confidence": "experimental",
      "exercised_by_cases": []
    },
    {
      "id": "electromech.relay",
      "exists": true,
      "solver": null,
      "simulated": false,
      "confidence": "experimental",
      "exercised_by_cases": []
    },
    {
      "id": "electromech.stepper-motor",
      "exists": true,
      "solver": null,
      "simulated": false,
      "confidence": "experimental",
      "exercised_by_cases": []
    },
    {
      "id": "env.airspace",
      "exists": true,
      "solver": "environment",
      "simulated": true,
      "confidence": "partial",
      "exercised_by_cases": [
        "environment/recorded-weather",
        "mechanics/determinism",
        "mechanics/drone-hover"
      ]
    },
    {
      "id": "env.ground",
      "exists": true,
      "solver": "environment",
      "simulated": true,
      "confidence": "partial",
      "exercised_by_cases": [
        "mechanics/drone-hover"
      ]
    },
    {
      "id": "env.water_body",
      "exists": true,
      "solver": "environment",
      "simulated": true,
      "confidence": "partial",
      "exercised_by_cases": [
        "environment/recorded-weather",
        "mechanics/boat-speed",
        "mechanics/buoyancy",
        "mechanics/coupling",
        "mechanics/determinism",
        "mechanics/terminal-velocity"
      ]
    },
    {
      "id": "input.analog-joystick",
      "exists": true,
      "solver": "mcu",
      "simulated": true,
      "confidence": "partial",
      "exercised_by_cases": []
    },
    {
      "id": "input.dip-switch-8",
      "exists": true,
      "solver": "mcu",
      "simulated": true,
      "confidence": "partial",
      "exercised_by_cases": []
    },
    {
      "id": "input.ir-receiver",
      "exists": true,
      "solver": null,
      "simulated": false,
      "confidence": "experimental",
      "exercised_by_cases": []
    },
    {
      "id": "input.ir-remote",
      "exists": true,
      "solver": null,
      "simulated": false,
      "confidence": "experimental",
      "exercised_by_cases": []
    },
    {
      "id": "input.membrane-keypad",
      "exists": true,
      "solver": "mcu",
      "simulated": true,
      "confidence": "partial",
      "exercised_by_cases": []
    },
    {
      "id": "input.potentiometer",
      "exists": true,
      "solver": "mcu",
      "simulated": true,
      "confidence": "partial",
      "exercised_by_cases": []
    },
    {
      "id": "input.pushbutton",
      "exists": true,
      "solver": "mcu",
      "simulated": true,
      "confidence": "partial",
      "exercised_by_cases": []
    },
    {
      "id": "input.pushbutton-6mm",
      "exists": true,
      "solver": "mcu",
      "simulated": true,
      "confidence": "partial",
      "exercised_by_cases": []
    },
    {
      "id": "input.rotary-dialer",
      "exists": true,
      "solver": "mcu",
      "simulated": true,
      "confidence": "partial",
      "exercised_by_cases": []
    },
    {
      "id": "input.slide-potentiometer",
      "exists": true,
      "solver": "mcu",
      "simulated": true,
      "confidence": "partial",
      "exercised_by_cases": []
    },
    {
      "id": "input.slide-switch",
      "exists": true,
      "solver": "mcu",
      "simulated": true,
      "confidence": "partial",
      "exercised_by_cases": []
    },
    {
      "id": "input.tilt-switch",
      "exists": true,
      "solver": "mcu",
      "simulated": true,
      "confidence": "partial",
      "exercised_by_cases": []
    },
    {
      "id": "logic.a4988",
      "exists": true,
      "solver": null,
      "simulated": false,
      "confidence": "experimental",
      "exercised_by_cases": []
    },
    {
      "id": "logic.bjt-2n2222",
      "exists": true,
      "solver": null,
      "simulated": false,
      "confidence": "experimental",
      "exercised_by_cases": []
    },
    {
      "id": "logic.bjt-2n3055",
      "exists": true,
      "solver": null,
      "simulated": false,
      "confidence": "experimental",
      "exercised_by_cases": []
    },
    {
      "id": "logic.bjt-2n3906",
      "exists": true,
      "solver": null,
      "simulated": false,
      "confidence": "experimental",
      "exercised_by_cases": []
    },
    {
      "id": "logic.bjt-bc547",
      "exists": true,
      "solver": null,
      "simulated": false,
      "confidence": "experimental",
      "exercised_by_cases": []
    },
    {
      "id": "logic.bjt-bc557",
      "exists": true,
      "solver": null,
      "simulated": false,
      "confidence": "experimental",
      "exercised_by_cases": []
    },
    {
      "id": "logic.diode",
      "exists": true,
      "solver": "circuit",
      "simulated": true,
      "confidence": "partial",
      "exercised_by_cases": []
    },
    {
      "id": "logic.diode-1n4007",
      "exists": true,
      "solver": "circuit",
      "simulated": true,
      "confidence": "partial",
      "exercised_by_cases": []
    },
    {
      "id": "logic.diode-1n4148",
      "exists": true,
      "solver": "circuit",
      "simulated": true,
      "confidence": "partial",
      "exercised_by_cases": []
    },
    {
      "id": "logic.diode-1n5817",
      "exists": true,
      "solver": null,
      "simulated": false,
      "confidence": "experimental",
      "exercised_by_cases": []
    },
    {
      "id": "logic.diode-1n5819",
      "exists": true,
      "solver": null,
      "simulated": false,
      "confidence": "experimental",
      "exercised_by_cases": []
    },
    {
      "id": "logic.flip-flop-d",
      "exists": true,
      "solver": null,
      "simulated": false,
      "confidence": "experimental",
      "exercised_by_cases": []
    },
    {
      "id": "logic.flip-flop-jk",
      "exists": true,
      "solver": null,
      "simulated": false,
      "confidence": "experimental",
      "exercised_by_cases": []
    },
    {
      "id": "logic.flip-flop-t",
      "exists": true,
      "solver": null,
      "simulated": false,
      "confidence": "experimental",
      "exercised_by_cases": []
    },
    {
      "id": "logic.ic-74hc00",
      "exists": true,
      "solver": null,
      "simulated": false,
      "confidence": "experimental",
      "exercised_by_cases": []
    },
    {